[
  {
    "source_id": "SRC-001",
    "is_mock": true,
    "source_type": "company_news",
    "title": "虚构北岸项目动态（演示）",
    "provider": "澄岳虚构新能源平台",
    "publish_date": "2025-03-10",
    "locator": "mock://company/north-001",
    "availability": "online",
    "data_origin": "mock"
  },
  {
    "source_id": "SRC-002",
    "is_mock": true,
    "source_type": "government_news",
    "title": "虚构北岸项目备案信息（演示）",
    "provider": "虚构省能源信息办公室",
    "publish_date": "2025-03-15",
    "locator": "mock://government/north-002",
    "availability": "online",
    "data_origin": "mock"
  },
  {
    "source_id": "SRC-003",
    "is_mock": true,
    "source_type": "research_report",
    "title": "虚构储能项目跟踪研究（演示）",
    "provider": "虚构产业研究室",
    "publish_date": "2025-04-01",
    "locator": "mock://research/storage-003",
    "availability": "offline",
    "data_origin": "mock"
  },
  {
    "source_id": "SRC-004",
    "is_mock": true,
    "source_type": "internal_ledger",
    "title": "澄岳虚构项目内部台账（演示）",
    "provider": "澄岳虚构新能源平台",
    "publish_date": "2025-04-05",
    "locator": "mock://internal/ledger-004",
    "availability": "offline",
    "data_origin": "mock"
  },
  {
    "source_id": "SRC-005",
    "is_mock": true,
    "source_type": "internal_report",
    "title": "澄岳虚构历史战略研判摘录（演示）",
    "provider": "澄岳虚构能源集团研究室",
    "publish_date": "2025-02-01",
    "locator": "mock://internal/report-005",
    "availability": "offline",
    "data_origin": "mock"
  }
]
